{
  "$schema": "http://json-schema.org/draft-07/schema#",
  "title": "MidnightPrivacyConfig",
  "description": "Initial configuration for midnight-privacy module.",
  "type": "object",
  "required": [
    "admin",
    "domain",
    "method_id",
    "root_window_size",
    "token_id",
    "tree_depth"
  ],
  "properties": {
    "admin": {
      "description": "Admin of the module who can update the method ID.",
      "allOf": [
        {
          "$ref": "#/definitions/Address"
        }
      ]
    },
    "backend": {
      "description": "Proof backend to use: \"ligero\" (default) or \"nightstream\".",
      "default": "ligero",
      "type": "string"
    },
    "domain": {
      "description": "Domain tag used in all note/hash derivations",
      "type": "array",
      "items": {
        "type": "integer",
        "format": "uint8",
        "minimum": 0.0
      },
      "maxItems": 32,
      "minItems": 32
    },
    "method_id": {
      "description": "Code commitment (32 bytes) of the guest program that verifies spend proofs. For Ligero: SHA-256(WASM program bytes || packing parameter). For Nightstream: SHA-256(ROM bytes).",
      "type": "array",
      "items": {
        "type": "integer",
        "format": "uint8",
        "minimum": 0.0
      },
      "maxItems": 32,
      "minItems": 32
    },
    "pool_admins": {
      "description": "Optional initial set of pool admins allowed to update `blacklist_root`.\n\nIf omitted, defaults to a singleton set containing `admin`.",
      "type": [
        "array",
        "null"
      ],
      "items": {
        "$ref": "#/definitions/Address"
      }
    },
    "root_window_size": {
      "description": "Size of the recent roots window (how many recent roots to keep)",
      "type": "integer",
      "format": "uint32",
      "minimum": 0.0
    },
    "token_id": {
      "description": "Single supported token (native)",
      "allOf": [
        {
          "$ref": "#/definitions/TokenId"
        }
      ]
    },
    "tree_depth": {
      "description": "Depth of the commitment tree (tree will have 2^depth leaves)",
      "type": "integer",
      "format": "uint8",
      "minimum": 0.0
    }
  },
  "definitions": {
    "Address": {
      "description": "Address",
      "type": "string",
      "pattern": "^sov1[a-zA-Z0-9]+$"
    },
    "TokenId": {
      "description": "A bech32 string",
      "type": "string",
      "pattern": "token_1[a-zA-Z0-9]+$"
    }
  }
}
