{
  "tree_depth": 16,
  "root_window_size": 100,
  "method_id": [0, 0, 0, 0, 0, 0, 0, 0, 0, 0, 0, 0, 0, 0, 0, 0, 0, 0, 0, 0, 0, 0, 0, 0, 0, 0, 0, 0, 0, 0, 0, 0],
  "admin": "sov1lzkjgdaz08su3yevqu6ceywufl35se9f33kztu5cu2spja5hyyf",
  "domain": [0, 0, 0, 0, 0, 0, 0, 0, 0, 0, 0, 0, 0, 0, 0, 0, 0, 0, 0, 0, 0, 0, 0, 0, 0, 0, 0, 0, 0, 0, 0, 0],
  "token_id": "token_1nyl0e0yweragfsatygt24zmd8jrr2vqtvdfptzjhxkguz2xxx3vs0y07u7"
}
